{
  "system_metadata": {
    "version": "1.0.0",
    "created_at": "2024-09-08T10:30:00Z",
    "updated_at": "2024-09-08T15:45:23Z",
    "embedding_dimension": 4,
    "total_memories": 1,
    "storage_path": "/data/memory_cathedral",
    "configuration": {
      "similarity_threshold": 0.75,
      "max_retrieval_results": 8,
      "auto_clustering_enabled": true,
      "temporal_decay_factor": 0.93
    }
  },
  "memory_entries": {
    "f47ac10b-58cc-4372-a567-0e02b2c3d479": {
      "memory_stamp": {
        "timestamp": "2024-09-08T14:23:17Z",
        "event_id": "f47ac10b-58cc-4372-a567-0e02b2c3d479",
        "location": "Home Office",
        "source": "conversation_agent",
        "signature_hash": "a1b2c3d4e5f6a7b8",
        "session_id": "3fa85f64-5717-4562-b3fc-2c963f66afa6",
        "user_id": "user_alice"
      },
      "encoded_experience": {
        "raw_text": "Successfully implemented the episodic memory system with full JSON schema validation.",
        "vector_embedding": [
          0.1,
          -0.3,
          0.7,
          0.2
        ],
        "reward_signal": 0.85,
        "emotional_tone": "positive",
        "context_tags": [
          "programming",
          "success",
          "memory_system",
          "json"
        ],
        "importance_score": 0.9,
        "associated_emotions": [
          {
            "emotion": "satisfaction",
            "intensity": 0.8
          },
          {
            "emotion": "pride",
            "intensity": 0.7
          }
        ]
      },
      "index_map": {
        "semantic_cluster_id": "cluster_0",
        "time_index": "2024-09-08",
        "graph_node_id": "2b1e9b87-28a1-4a63-8c25-5b0dcab22e3f",
        "related_nodes": [
          "5b6a9b8f-3d6d-4f6a-8d4e-1a2b3c4d5e6f",
          "0a2b3c4d-5e6f-7a8b-9c0d-112233445566"
        ],
        "hierarchical_path": [
          "technology",
          "ai",
          "memory_systems"
        ],
        "access_frequency": 3,
        "last_accessed": "2024-09-08T15:30:00Z"
      },
      "integration_plan": {
        "augmentation_target": "LLM_context",
        "confidence_score": 0.92,
        "integration_notes": "High relevance for technical discussions.",
        "priority_weight": 0.8,
        "staleness_factor": 0.05,
        "context_relevance": 0.95
      }
    }
  },
  "indexing_structures": {
    "semantic_clusters": {
      "cluster_0": {
        "cluster_id": "cluster_0",
        "centroid_embedding": [
          0.1,
          -0.3,
          0.7,
          0.2
        ],
        "member_count": 1,
        "memory_ids": [
          "f47ac10b-58cc-4372-a567-0e02b2c3d479"
        ],
        "creation_timestamp": "2025-09-08T17:15:45Z",
        "last_updated": "2025-09-08T17:15:45Z",
        "cluster_quality_score": 1.0
      }
    },
    "temporal_index": {
      "2024-09-08": {
        "date": "2024-09-08",
        "memory_ids": [
          "f47ac10b-58cc-4372-a567-0e02b2c3d479"
        ],
        "event_density": 1,
        "significance_score": 0.0
      }
    },
    "graph_connections": {
      "2b1e9b87-28a1-4a63-8c25-5b0dcab22e3f": {
        "node_id": "2b1e9b87-28a1-4a63-8c25-5b0dcab22e3f",
        "connections": [
          {
            "target_node_id": "5b6a9b8f-3d6d-4f6a-8d4e-1a2b3c4d5e6f",
            "connection_strength": 0.6,
            "connection_type": "semantic",
            "created_at": "2024-09-08T15:00:00Z"
          }
        ],
        "centrality_score": 0.12,
        "clustering_coefficient": 0.4
      }
    }
  },
  "integration_specifications": {
    "llm_context_format": {
      "template": ">>> {memory.raw_text} (conf={confidence_score})",
      "max_memory_count": 5,
      "context_window_size": 2048,
      "include_metadata": true,
      "confidence_threshold": 0.7
    },
    "planner_input_format": {
      "schema_version": "1.0",
      "required_fields": [
        "raw_text",
        "importance_score",
        "context_tags"
      ],
      "aggregation_method": "recency_weighted",
      "temporal_weighting": true
    },
    "rl_replay_format": {
      "state_representation": "hybrid",
      "reward_normalization": true,
      "batch_size": 32,
      "priority_sampling": false
    }
  }
}